em_cedula,n_empleado,coen_entrada,coen_salida,rol,dia_reporte,tienda_reporte
31184080,"ELIAN MAXIMO, CARTER SILVA",07:00 AM,11:00 AM,Gerente de Tienda,2020-12-01,UCABmart - El Cafetal
23346416,"CELESTE SOLEDAD, CHACON MACHADO",07:00 AM,12:00 PM,Coordinador de Promocion y Ventas,2020-12-01,UCABmart - El Cafetal
26722685,"MARLENE DONATILA, ROSA ALMAZAN",07:00 AM,12:00 PM,Coordinador de Talento Humano,2020-12-01,UCABmart - El Cafetal
12317873,"FABIANO TARSICIO, SANTAMARIA JAQUEZ",12:00 PM,07:00 PM,Jefe de Compras/Atencion al Cliente,2020-12-01,UCABmart - El Cafetal
27811618,"VIVALDO TARSICIO, ROSAS JACKSON",12:00 PM,07:00 PM,Cajero,2020-12-01,UCABmart - El Cafetal
25213954,"GRACIA BERENICE, BOCANEGRA RIZO",12:00 PM,07:00 PM,Cajero,2020-12-01,UCABmart - El Cafetal
